{"projection_id":"notion-projection-00000001","schema_version":"2.0.0","integration_mode":"simulated","simulation_id":"sim-00000001","projected_at":"2026-08-19T12:00:00Z","source_event_id":"event-00000001","source_revision":1,"identity":{"tenant_id":"tenant-sim","project_id":"project-sim","run_id":"run-00000001","step_id":"4a","revision":1},"projection_role":"operative_projection","state_authority":"transition_service","atomic_state_writer":false,"records":{"customer-00000001":{"record_type":"customer","subject_id":"customer-00000001","title":"Archetype customer","projected_status":"active","source_event_id":"event-00000001","source_revision":1,"relations":[{"relation_type":"project","target_record_id":"project-00000001"}]},"project-00000001":{"record_type":"project","subject_id":"project-00000001","title":"Archetype project","projected_status":"active","source_event_id":"event-00000001","source_revision":1,"relations":[{"relation_type":"customer","target_record_id":"customer-00000001"}]},"run-00000001":{"record_type":"run","subject_id":"run-00000001","title":"Step run","projected_status":"active","source_event_id":"event-00000002","source_revision":1,"relations":[{"relation_type":"project","target_record_id":"project-00000001"}]},"step-00000001":{"record_type":"step","subject_id":"step-00000001","title":"Workflow step","projected_status":"ready","source_event_id":"event-00000002","source_revision":1,"relations":[{"relation_type":"run","target_record_id":"run-00000001"}]},"task-00000001":{"record_type":"task","subject_id":"task-00000001","title":"Role task","projected_status":"open","source_event_id":"event-00000008","source_revision":1,"relations":[{"relation_type":"run","target_record_id":"run-00000001"}]},"assignment-00000001":{"record_type":"assignment","subject_id":"assignment-00000001","title":"Role assignment","projected_status":"assigned","source_event_id":"event-00000014","source_revision":1,"relations":[{"relation_type":"task","target_record_id":"task-00000001"}]},"artifact-00000001":{"record_type":"artifact","subject_id":"artifact-00000001","title":"Immutable artifact","projected_status":"created","source_event_id":"event-00000004","source_revision":1,"relations":[{"relation_type":"run","target_record_id":"run-00000001"}]},"gate-00000001":{"record_type":"gate","subject_id":"gate-00000001","title":"Quality gate","projected_status":"ready","source_event_id":"event-00000005","source_revision":1,"relations":[{"relation_type":"artifact","target_record_id":"artifact-00000001"}]},"review-00000001":{"record_type":"review","subject_id":"review-00000001","title":"Artifact review","projected_status":"pending","source_event_id":"event-00000005","source_revision":1,"relations":[{"relation_type":"gate","target_record_id":"gate-00000001"}]},"approval-00000001":{"record_type":"approval","subject_id":"approval-00000001","title":"Gate approval","projected_status":"recorded","source_event_id":"event-00000015","source_revision":1,"relations":[{"relation_type":"review","target_record_id":"review-00000001"}]},"blocker-00000001":{"record_type":"blocker","subject_id":"blocker-00000001","title":"Evidence blocker","projected_status":"resolved","source_event_id":"event-00000016","source_revision":1,"relations":[{"relation_type":"task","target_record_id":"task-00000001"}]},"defect-00000001":{"record_type":"defect","subject_id":"defect-00000001","title":"Delivery defect","projected_status":"open","source_event_id":"event-00000010","source_revision":1,"relations":[{"relation_type":"blocker","target_record_id":"blocker-00000001"}]},"escalation-00000001":{"record_type":"escalation","subject_id":"escalation-00000001","title":"Decision escalation","projected_status":"open","source_event_id":"event-00000011","source_revision":1,"relations":[{"relation_type":"defect","target_record_id":"defect-00000001"}]},"performance-checkpoint-00000001":{"record_type":"performance_checkpoint","subject_id":"performance-checkpoint-00000001","title":"Confirmed checkpoint","projected_status":"due","source_event_id":"event-00000017","source_revision":2,"relations":[{"relation_type":"project","target_record_id":"project-00000001"}]},"metric-00000001":{"record_type":"metric","subject_id":"metric-00000001","title":"Observed metric","projected_status":"recorded","source_event_id":"event-00000018","source_revision":2,"relations":[{"relation_type":"performance_checkpoint","target_record_id":"performance-checkpoint-00000001"}]},"adjustment-proposal-00000001":{"record_type":"adjustment_proposal","subject_id":"adjustment-proposal-00000001","title":"Adjustment proposal","projected_status":"pending","source_event_id":"event-00000019","source_revision":2,"relations":[{"relation_type":"metric","target_record_id":"metric-00000001"}]},"integration-status-00000001":{"record_type":"integration_status","subject_id":"integration-status-00000001","title":"Integration delivery","projected_status":"failed","source_event_id":"event-00000020","source_revision":1,"relations":[{"relation_type":"project","target_record_id":"project-00000001"}]}}}
